Sociedad de Constructores de calzado;1901;Mejorar las condiciones del trabajo;Idenl;BARCELONA;90.0;;;;90.0;;;;;
Sociedad de Oficiales y Aprendices albaniles;1902;Mejorar las condiciones del trabajo;Sitges;BARCELONA;23.0;;;;23.0;;;;;
Casa del Pueblo;1904;Cooperativa de consumo;Sitges;BARCELONA;82.0;;;;82.0;;;;;
Circulo Socialista del Partido Obrero;1904;Política de partido;Sitges;BARCELONA;36.0;;;;36.0;;;;;
L Aureneta de Ordal;1899;Coral;Subirats;BARCELONA;36.0;;;;36.0;;;;;
La Palma Teyanense;1901;Coral;Teya;BARCELONA;36.0;4.0;;11.0;51.0;;;;;
La Union Valliranense;1902;Coral;Vallirana;BARCELONA;87.0;;;;87.0;;;;;
La Agricola;1903;Coral;Vilovi;BARCELONA;50.0;;;;50.0;;;;;
Sociedad protectora de Jovenes Obreros y Comerciantes;1889;Acción católica;Zaragoza;ZARAGOZA;;;;;;;;;;
Asociación del Arte de Imprimir y similares;1899;Mejorar las condiciones del trabajo;Zaragoza;ZARAGOZA;159.0;;;1.0;160.0;;;;;
I Sociedad de Pintores;1899;Mejorar las condiciones del trabajo;Zaragoza;ZARAGOZA;60.0;;;;60.0;;;;;
SocIedad de Obreros zapateros;1899;Mejorar las condiciones del trabajo;Zaragoza;ZARAGOZA;208.0;;;;208.0;;;;;
Sociedad de Fundidores en hierro y otros metales;1900;Mejorar las condiciones del trabajo;Zaragoza;ZARAGOZA;90.0;;;;90.0;;;;;
Sociedad de Obreros constructores de carros;1900;Mejorar las condiciones del trabajo;Zaragoza;ZARAGOZA;27.0;;;;27.0;;;;;
Sociedad de Constructores de máquinas;1900;Mejorar las condiciones del trabajo;Zaragoza;ZARAGOZA;100.0;;;;100.0;;;;;
Sociedad de Sombrereros Planchadores y Armadores;1900;Mejorar las condiciones del trabajo;Zaragoza;ZARAGOZA;28.0;;;;28.0;;;;;
i Sociedad de Obreros carpinteros y Ebanistas;1900;Mejorar las condiciones del trabajo;Zaragoza;ZARAGOZA;580.0;;;;580.0;;;;;
Sociedad de Obreros curtidores;1900;Mejorar las condiciones del trabajo;Zaragoza;ZARAGOZA;120.0;;;;120.0;;;;;
I Sociedad de Obreros silleros;1900;Mejorar las condiciones del trabajo;Zaragoza;ZARAGOZA;60.0;;;;60.0;;;;;
El Porvenir agrupación general de cocineros camareros y reposteros;1900;Mejorar las condiciones del trabajo;Zaragoza;ZARAGOZA;180.0;;;4.0;184.0;;;;;
Unión Ultramarina de Dependientes;1900;Mejorar las condiciones del trabajo;Zaragoza;ZARAGOZA;60.0;12.0;2.0;25.0;99.0;;;;;
Asociación general de Dependientes;1900;Mejorar las condiciones del trabajo;Zaragoza;ZARAGOZA;150.0;;;30.0;180.0;;;;;
Sociedad de Obreros fideeros;1904;Mejorar las condiciones del trabajo;Zaragoza;ZARAGOZA;5.0;;;;5.0;;;;;
Sociedad de Obreros guarnicioneros;1904;Mejorar las condiciones del trabajo;Zaragoza;ZARAGOZA;7.0;;;;7.0;;;;;
Agrupación Socialista;1891;Política de partido;Zaragoza;ZARAGOZA;40.0;;;;40.0;;;;;
Orfeón Zaragozano;1843;Coral;Zaragoza;ZARAGOZA;63.0;;3.0;70.0;136.0;;;;;
Sociedad Obrera;1904;Mejorar las condiciones del trabajo;Pina;ZARAGOZA;185.0;;;;185.0;;;;;
Sociedad de Obreros del campo;1903;Mejorar las condiciones del trabajo;Tarazona;ZARAGOZA;206.0;;;;206.0;;;;;
Sociedad de Obreros albañiles y similares;1903;Mejorar las condiciones del trabajo;Tarazona;ZARAGOZA;80.0;;;;80.0;;;;;
Sociedad de Obreros zapateros;1903;Mejorar las condiciones del trabajo;Tarazona;ZARAGOZA;18.0;;;;18.0;;;;;
Sociedad de obreros de fábricas de fósforo;1903;Mejorar las condiciones del trabajo;Tarazona;ZARAGOZA;30.0;;;;30.0;;;;;
Sociedad de obreros alpargateros;1903;Mejorar las condiciones del trabajo;Tarazona;ZARAGOZA;16.0;;;;16.0;;;;;
Sociedad de Obreros de pelairia;1903;Mejorar las condiciones del trabajo;Tarazona;ZARAGOZA;20.0;;;;20.0;;;;;
Federación local de Sociedades Obreras;1903;Mejorar las condiciones del trabajo;Tarazona;ZARAGOZA;370.0;;;;370.0;;;;;
Caja de Ahorros de los Obreros de la Fábrica de los Sres Montes;1904;Cooperativa de credito y de consumo con Caja de socorros;Tarazona;ZARAGOZA;78.0;;2.0;;80.0;;;;;
Unión Republicana;1904;Política de partido;Castejon De Valdejasa;ZARAGOZA;60.0;1.0;1.0;;62.0;;;;;
Sociedad de Obreros;1902;Mejorar las condiciones del trabajo;Escartón;ZARAGOZA;84.0;;;;84.0;;;;;
Centro de Obreros;1904;Socorro mutuo;Novallas;ZARAGOZA;100.0;;;;100.0;;;;;
Sociedad de Obreros;1902;Mejorar las condiciones del trabajo;Sástago;ZARAGOZA;343.0;;;;343.0;;;;;
Sociedad de Obreros Albañiles;1900;;Almansa;ALBACETE;75.0;;;;75.0;;;Mejorar las conidiciones del trabajo;;
Sociedadde Obreros Agricultores;1903;;Almansa;ALBACETE;421.0;;;;421.0;;;Mejorar las conidiciones del trabajo;;
Agrupación Socialista;1903;;Almansa;ALBACETE;35.0;;;;35.0;;;Política de partido;;
La Esperanza;1903;;Barrax;ALBACETE;115.0;;3.0;;118.0;;;Socorro mutuo;;
El Porvenir;1903;;Bonete;ALBACETE;310.0;;;1.0;311.0;;;Mejorar las condiciones del trabajo;;
La Humildad obreros agrícolas;1904;;Caudete;ALBACETE;530.0;;;;530.0;;;idem;;
Sociedad de Obreros Albañiles;1904;;Caudete;ALBACETE;50.0;;;;50.0;;;idem;;
La Invencible;1903;;Higueruela;ALBACETE;40.0;;;50.0;90.0;;;Socorro mutuo;;
La Redención;1904;;Montealegre;ALBACETE;290.0;;;;290.0;;;Mejorar las condiciones del trabajo;;
La Emancipación;1902;;Ontur;ALBACETE;274.0;;;;274.0;;;Socorro mutuo;;
Sociedad de Oficiales pintores decoradores;1899;Mejorar las condiciones del trabajo;San Sebastián;GUIPUZCOA;40.0;;;;40.0;;;;;
Sociedad de Obreros panaderos;1900;Mejorar las condiciones del trabajo;San Sebastián;GUIPUZCOA;65.0;;;;65.0;;;;;
Sociedad de Obreros hojalateros y similares;1900;Mejorar las condiciones del trabajo;San Sebastián;GUIPUZCOA;78.0;;;;78.0;;;;;
Sociedad de Camareros;1901;Mejorar las condiciones del trabajo;San Sebastián;GUIPUZCOA;12.0;;4.0;;16.0;;;;;
Sociedad de Socorros mutuos de Pescadores;1901;Socorro mutuo;San Sebastián;GUIPUZCOA;280.0;;;;280.0;;;;;
Caja de Auxilios del personal obrero de la Fábrica de Tabacos;1901;Socorro mutuo;San Sebastián;GUIPUZCOA;509.0;;;2.0;511.0;;;;;
La Esperanza obreros de la Sociedad J M Resola y Compañía;1903;Socorro mutuo;San Sebastián;GUIPUZCOA;120.0;;;;120.0;;;;;
La Unión banda de música;1886;Musical;San Sebastián;GUIPUZCOA;28.0;;;;28.0;;;;;
Orfeón Socialista;1904;Coral;San Sebastián;GUIPUZCOA;40.0;;;30.0;70.0;;;;;
Sociedad de Oficios varios;1901;Mejorar las condiciones del trabajo;Tolosa;GUIPUZCOA;80.0;;;;80.0;;;;;
Centro Musical Tolosano;1901;Musical;Tolosa;GUIPUZCOA;132.0;;16.0;196.0;344.0;;;;;
Sociedad de Obreros eatólicos del Purísimo Corazón de Maria;1891;Acción católica;Azcoitia;GUIPUZCOA;187.0;;2.0;22.0;211.0;;;;;
Sociedad de Obreros cajeros;1900;Mejorar las condiciones del trabajo;Éibar;GUIPUZCOA;76.0;;;;76.0;;;;;
Sociedad de Obreros pulidores;1900;Mejorar las condiciones del trabajo;Éibar;GUIPUZCOA;54.0;;;;54.0;;;;;
Sociedad de Obreros basculadores;1900;Mejorar las condiciones del trabajo;Éibar;GUIPUZCOA;127.0;;;;127.0;;;;;
Sociedad de Obreros grahadores;1900;Mejorar las condiciones del trabajo;Éibar;GUIPUZCOA;24.0;;;;24.0;;;;;
Sociedad de Ohreros arregladores chokeadores;1900;Mejorar las condiciones del trabajo;Éibar;GUIPUZCOA;19.0;;;;19.0;;;;;
Sociedad de Obreros canonistas;1900;Mejorar las condiciones del trabajo;Éibar;GUIPUZCOA;24.0;;;;24.0;;;;;
Sociedad de Obreros pistoleros;1900;Mejorar las condiciones del trabajo;Éibar;GUIPUZCOA;390.0;;;;390.0;;;;;
Sociedad de Oficios varios;1900;Mejorar las condiciones del trabajo;Éibar;GUIPUZCOA;44.0;;;;44.0;;;;;
Federación de Sociedades obreras en la industria armera;1901;Mejorar las condiciones del trabajo;Éibar;GUIPUZCOA;367.0;;;;367.0;;;;;
Centro de Sociedades obreras;1902;Mejorar las condiciones del trabajo;Éibar;GUIPUZCOA;922.0;;;;922.0;;;;;
Agrupación Socialista;1897;Política de partido;Éibar;GUIPUZCOA;97.0;;;;97.0;;;;;
Juventud Socialista;1904;Política de partido;Éibar;GUIPUZCOA;134.0;;;;134.0;;;;;
La Protectora;1885;Socorro mutuo  o;Irún;GUIPUZCOA;84.0;;;;84.0;;;;;
Unión de Artesanos;1894;Recreo;Irún;GUIPUZCOA;24.0;;;;24.0;;;;;
Sociedad de Oficiales toneleros;1900;Mejorar las condiciones del trabajo;Pasages;GUIPUZCOA;50.0;;;;50.0;;;;;
Banda y Orfeón de Pasages Ancho;1901;Musical;Pasages;GUIPUZCOA;56.0;;2.0;1.0;59.0;;;;;
Sociedad de Oficios varios;1904;Mejorar las condiciones elel trabajo;Renteria;GUIPUZCOA;31.0;;;;31.0;;;;;
Orfeón Renteriano;1895;Coral;Renteria;GUIPUZCOA;35.0;;70.0;;105.0;;;;;
Sociedad de socorros mutuos de la fabrica de papel La Salvadora;1901;Socorro mutuo;Villabona;GUIPUZCOA;73.0;;;;73.0;;;;;
Asociación protectora de Artesanos jóvenes;1866;Acción católica;Madrid;MADRID;62.0;;31.0;8.0;101.0;;;;;
Circulo Católico de Obreros de San Pedro Apóstol;1895;Acción católica;Madrid;MADRID;;;;;;;;;;
Circulo Católico de Obreros del Sagrado Corazon de Jesús;1895;Acción católica;Madrid;MADRID;;;;200.0;2037.0;;;;;
Asociación general del Arte de Imprimir;1871;Mejorar las condiciones del trabajo;Madrid;MADRID;956.0;;;;956.0;;;;;
El Porvenirobreros en hierro y demás metales;1881;Mejorar las condiciones del trabajo;Madrid;MADRID;180.0;;;;180.0;;;;;
El Trabajo obreros albañiles;1888;Mejorar las condiciones del trabajo;Madrid;MADRID;;;;;;;;;;
Sociedad de Oficiales zapateros Cortadores y Guarnicioneros;1890;Mejorar las condiciones del trabajo;Madrid;MADRID;104.0;;;;104.0;;;;;
Sociedad de Canteros y similares;1890;Mejorar las condiciones del trabajo;Madrid;MADRID;820.0;;;;820.0;;;;;
Sociedad de Obreros constructores de carruajes;1890;Mejorar las condiciones del trabajo;Madrid;MADRID;274.0;;;;274.0;;;;;
Unión Obrera del Gremio de Albañiles;1890;Mejorar las condiciones del trabajo;Madrid;MADRID;225.0;;2.0;;227.0;;;;;
Sociedad de Obreros marmolistas;1890;Mejorar las condiciones del trabajo;Madrid;MADRID;402.0;;;;402.0;;;;;
La Solidaridad obreros estuquistas;1891;Mejorar las condiciones del trabajo;Madrid;MADRID;94.0;;;;94.0;;;;;
Sociedad de Obreros panaderos de la provincia;1892;Mejorar las condiciones del trabajo;Madrid;MADRID;;;;;;;;;;
La Verdad Social obreros carpinteros de armar;1893;Mejorar las condiciones del trabajo;Madrid;MADRID;397.0;;;;397.0;;;;;
Sociedad de Profesiones y Oficios yarios;1893;Mejorar las condiciones del trabajo;Madrid;MADRID;363.0;;;;363.0;;;;;
La Puntual obreros fontaneros y vidrieros;1893;Mejorar las condiciones del trabajo;Madrid;MADRID;150.0;;;;150.0;;;;;
Agrupación general de Camareros Cocineros y Reposteros;1896;Mejorar las condiciones del trabajo;Madrid;MADRID;927.0;;;;927.0;;;;;
La Unión de Cocheros;1897;Mejorar las condiciones del trabajo;Madrid;MADRID;;;;;;;;;;
Sociedad de Carpinteros de taller;1897;Mejorar las condiciones del trabajo;Madrid;MADRID;761.0;;;;761.0;;;;;
La Emancipación obreros embaldosadores;1897;Mejorar las condiciones del trabajo;Madrid;MADRID;130.0;;;;130.0;;;;;
La Piqueta obreros poceros;1897;Mejorar las condiciones del trabajo;Madrid;MADRID;201.0;;;;201.0;;;;;
Union Ultramarina Madrilena Sociedad de dependientes de los gremios ultramarinos y similares;1898;Mejorar las condiciones del trabajo;Madrid;MADRID;250.0;;;20.0;270.0;;;;;
La Rueda obreros constructores de carros;1899;Mejorar las condiciones del trabajo;Madrid;MADRID;50.0;;;;50.0;;;;;
El Compás obreros aserradores á brazo;1899;Mejorar las condiciones del trabajo;Madrid;MADRID;25.0;;;;25.0;;;;;
Sociedad de Operarios fumistas;1899;Mejorar las condiciones del trabajo;Madrid;MADRID;180.0;;;;180.0;;;;;
Sociedad de Mecánicos en hierro y demas metals;1899;Mejorar las condiciones del trabajo;Madrid;MADRID;200.0;;;;200.0;;;;;
Sociedad de Obreros curtidores y oficios similares;1899;Mejorar las condiciones del trabajo;Madrid;MADRID;185.0;;;;185.0;;;;;
Sociedad de Barnizadores de estuco;1899;Mejorar las condiciones del trabajo;Madrid;MADRID;13.0;;;;13.0;;;;;
Sociedad de Oficiales pintores decoradores;1899;Mejorar las condiciones del trabajo;Madrid;MADRID;944.0;;5.0;1.0;950.0;;;;;
La Emancipadora obreros carboneros;1899;Mejorar las condiciones del trabajo;Madrid;MADRID;20.0;;;;20.0;;;;;
Sociedad de Escultores Decoradores y similares;1900;Mejorar las condiciones del trabajo;Madrid;MADRID;68.0;;;;68.0;;;;;
Sociedad de Obreros desmontistas;1900;Mejorar las condiciones del trabajo;Madrid;MADRID;90.0;;;;90.0;;;;;
La Razón del Obrero obreros sastres;1900;Mejorar las condiciones del trabajo;Madrid;MADRID;120.0;;;;120.0;;;;;
Sociedad de Moldeadores de metales y similares;1900;Mejorar las condiciones del trabajo;Madrid;MADRID;69.0;;;;69.0;;;;;
Sociedad de Obreros broncistas y similares;1900;Mejorar las condiciones del trabajo;Madrid;MADRID;214.0;;1.0;1.0;216.0;;;;;
Sociedad de Colocadores de pavimentos en madera;1900;Mejorar las condiciones del trabajo;Madrid;MADRID;70.0;;1.0;;71.0;;;;;
La ProbidadSociedad de dependientes y cortadores de zapaterías;1900;Mejorar las condiciones del trabajo;Madrid;MADRID;93.0;;;;93.0;;;;;
Unión de Obreros de carros de mudanza;1901;Mejorar las condiciones del trabajo;Madrid;MADRID;70.0;;;;70.0;;;;;
Sociedad general de Vendedores ambulantes;1901;Mejorar las condiciones del trabajo;Madrid;MADRID;215.0;;;;215.0;;;;;
Unión de Dependientes de tablajerias y salchicherías;1901;Mejorar las condiciones del trabajo;Madrid;MADRID;101.0;;;14.0;115.0;;;;;
Asociadón de Obreros;1901;Mejorar las condiciones del trabajo;Madrid;MADRID;130.0;;;;130.0;;;;;
Asociadón de Impresores;1902;Mejorar las condiciones del trabajo;Madrid;MADRID;850.0;;;;850.0;;;;;
Sociedad de Sombrereros fulistas;1902;Mejorar las condiciones del trabajo;Madrid;MADRID;13.0;;;;13.0;;;;;
Sociedad de Obreros tejeros y similares;1902;Mejorar las condiciones del trabajo;Madrid;MADRID;193.0;;;2.0;195.0;;;;;
Sociedad de Herradores;1902;Mejorar las condiciones del trabajo;Madrid;MADRID;135.0;;;;135.0;;;;;
Sociedad de Obreros esparteros;1902;Mejorar las condiciones del trabajo;Madrid;MADRID;24.0;;;;24.0;;;;;
Unión de Sombrereros;1902;Mejorar las condiciones del trabajo;Madrid;MADRID;41.0;;;;41.0;;;;;
Asociación general de Dependientes de comercio;1902;Mejorar las condiciones del trabajo;Madrid;MADRID;320.0;;;65.0;385.0;;;;;
Unión de Dependientes de tiendas de aves corderos y caza;1902;Mejorar las condiciones del trabajo;Madrid;MADRID;250.0;;;;250.0;;;;;
Sociedad de Mozos empleados en fabricas almacenes y comercios;1902;Mejorar las condiciones del trabajo;Madrid;MADRID;46.0;;;;46.0;;;;;
Sociedad de Operarios y Repartidores de ensaimadas galletas pastelería y confitería;1902;Mejorar las condiciones del trabajo;Madrid;MADRID;200.0;;;;200.0;;;;;
Sociedad de Obreros en cajas de cartón;1903;Mejorar las condiciones del trabajo;Madrid;MADRID;41.0;;;;41.0;;;;;
La Electromecánica obreros electromecanicos;1903;Mejorar las condiciones del trabajo;Madrid;MADRID;35.0;;;;35.0;;;;;
Sociedad general de Obreros en fabricas de gas electricidad y similares;1903;Mejorar las condiciones del trabajo;Madrid;MADRID;436.0;;;;436.0;;;;;
Sociedad de Planchadoras Lavanderas y similares;1903;Mejorar las condiciones del trabajo;Madrid;MADRID;32.0;;;;32.0;;;;;
Sociedad de Obreros partidores y cortadores de leña;1903;Mejorar las condiciones del trabajo;Madrid;MADRID;30.0;;;;30.0;;;;;
Administración Mercantil Española empleados de banca industria y comercio;1903;Mejorar las condiciones del trabajo;Madrid;MADRID;300.0;;;;300.0;;;;;
Sociedad de Obreros sombrereros de fantasía;1903;Mejorar las condiciones del trabajo;Madrid;MADRID;54.0;;;;54.0;;;;;
Asociación de la Dependencia mercantil;1903;Mejorar las condiciones del trabajo;Madrid;MADRID;169.0;;;6.0;175.0;;;;;
Sociedad de Oficiales relojeros;1903;Mejorar las condiciones del trabajo;Madrid;MADRID;110.0;;;;110.0;;;;;
La Formal obreros carpinteros de taller;1904;Mejorar las condiciones del trabajo;Madrid;MADRID;300.0;;;;300.0;;;;;
Asociación de Obreros peluqueros barberos;1904;Mejorar las condiciones del trabajo;Madrid;MADRID;840.0;;;;840.0;;;;;
Sociedad de Obreros en articulos de viaje y Guarnicioneros en general;1904;Mejorar las condiciones del trabajo;Madrid;MADRID;71.0;;4.0;;75.0;;;;;
Sociedad de Obreros constructores de pianos y organos;1904;Mejorar las condiciones del trabajo;Madrid;MADRID;50.0;;;;50.0;;;;;
Sociedad general de Fotograbadores;1904;Mejorar las condiciones del trabajo;Madrid;MADRID;49.0;;;;49.0;;;;;
Sociedad de Obreros escultores de ornamentación;1904;Mejorar las condiciones del trabajo;Madrid;MADRID;24.0;;;;24.0;;;;;
Asociación de Modistas;1904;Mejorar las condiciones del trabajo;Madrid;MADRID;352.0;;;;352.0;;;;;
Sociedad de Operarios sombrereros planchadores de fieltro;1904;Mejorar las condiciones del trabajo;Madrid;MADRID;46.0;;;;46.0;;;;;
La Puntualidad repartidores de pan a domicilio;1904;Mejorar las condiciones del trabajo;Madrid;MADRID;221.0;;;;221.0;;;;;
Federación Nacional de Obreros metalúrgicos y similares de España;0;Mejorar las condiciones del trabajo;Madrid;MADRID;;;;;;;;;;
La Mutualidad Obrera;1904;Cooperativa medicofarmaceutica;Madrid;MADRID;;;;;;;;;;
Sociedad benefica de Socorros mutuos de Artifices plateros de Nuestra Señora de la Peña de Francia;1715;Socorro mutuo;Madrid;MADRID;175.0;4.0;33.0;14.0;226.0;;;;;
Sociedad de Socorros mutuos de los Obreros de la Imprenta;1848;Socorro mutuo;Madrid;MADRID;307.0;;;;307.0;;;;;
Sociedad de Socorros mutuos de cocheros;1850;Socorro mutuo;Madrid;MADRID;644.0;;;6.0;650.0;;;;;
Los Amigos;1853;Socorro mutuo;Madrid;MADRID;131.0;;;;131.0;;;;;
Sociedad de Socorros mutuos de tapiceros;1866;Socorro mutuo;Madrid;MADRID;107.0;;8.0;7.0;122.0;;;;;
La Fraternidad;1871;Socorro mutuo;Madrid;MADRID;196.0;;;;196.0;;;;;
Sociedad de Socorros mutuos de Litógrafos;1872;Socorro mutuo;Madrid;MADRID;115.0;;;;115.0;;;;;
La Fraternal obreros maquinistas y fogoneros de ferrocarriles;1872;Socorro mutuo;Madrid;MADRID;535.0;;;;535.0;;;;;
Montepio Obrero;1878;Socorro mutuo;Madrid;MADRID;60.0;;;;60.0;;;;;
Sociedad de Socorros mutuos de Operarios de Dependientes de E Menuses;1878;Socorro mutuo;Madrid;MADRID;110.0;;1.0;1.0;112.0;;;;;
El Alba dependientes de cafe y similares;1879;Socorro mutuo;Madrid;MADRID;484.0;;;26.0;510.0;;;;;
Sociedad de Socorros mutuos de Serenos de comercio y vecindario de Madrid;1880;Socorro mutuo;Madrid;MADRID;388.0;;;;388.0;;;;;
Sociedad de Socorros mutuos de Tipógrafos;1886;Socorro mutuo;Madrid;MADRID;258.0;;;;258.0;;;;;
Asociación general de Empleados y Obreros de ferrocarriles;1888;Socorro mutuo;Madrid;MADRID;;;;;;;;;;
El Pensamiento Noble;1888;Socorro mutuo;Madrid;MADRID;102.0;;;;102.0;;;;;
La Imprenta;1889;Socorro mutuo;Madrid;MADRID;84.0;;1.0;1.0;86.0;;;;;
La Honradez porteros;1891;Socorro mutuo;Madrid;MADRID;;;2.0;14.0;1950.0;;;;;
El Alivio modelistas y moldeadores;1891;Socorro mutuo;Madrid;MADRID;36.0;;;;36.0;;;;;
Sociedad general de Doradores;1892;Socorro mutuo;Madrid;MADRID;49.0;2.0;1.0;4.0;56.0;;;;;
Sociedad de Socorros de Peluqueros y Barberos de Madrid;1896;Socorro mutuo;Madrid;MADRID;242.0;;;;242.0;;;;;
La Siempreviva;1896;Socorro mutuo;Madrid;MADRID;44.0;;;;44.0;;;;;
La Previsora del Trabajo;1896;Socorro mutuo;Madrid;MADRID;102.0;;;;102.0;;;;;
La Caritativa;1897;Socorro mutuo;Madrid;MADRID;111.0;;;;111.0;;;;;
Sociedad de Socorros del Oficio de sombrereros;1898;Socorro mutuo;Madrid;MADRID;54.0;;;9.0;63.0;;;;;
Caritativa Moderna;1899;Socorro mutuo;Madrid;MADRID;42.0;;;;42.0;;;;;
El Buen Acuerdo;1899;Socorro mutuo;Madrid;MADRID;92.0;;;4.0;96.0;;;;;
Sociedad de Dependientes de compraventa mercantil;1900;Socorro mutuo;Madrid;MADRID;44.0;;;6.0;50.0;;;;;
Montepío de Dependientes de ferretería y similares;1900;Socorro mutuo;Madrid;MADRID;137.0;;;110.0;247.0;;;;;
Unión de Dependientes de sastrería y similares;1901;Socorro mutuo;Madrid;MADRID;109.0;;;21.0;130.0;;;;;
La Buena Unión;1901;Socorro mutuo;Madrid;MADRID;80.0;;;;80.0;;;;;
Sociedad de Socorros de Obrerps y Empleados de la Casa Hernando;1901;Socorro mutuo;Madrid;MADRID;63.0;;;;63.0;;;;;
Sociedad de Matarifes de vacas y carneros;1901;Socorro mutuo;Madrid;MADRID;106.0;;;;106.0;;;;;
Montepío de Empleados y de la Fabrica de electricidad del Norte;1901;Socorro mutuo;Madrid;MADRID;;;;;;;;;;
Sección de socorros de la Sociedad de Oficiales pintores decoradores;1902;Socorro mutuo;Madrid;MADRID;950.0;;;;950.0;;;;;
Sociedad Benéfica de Vendedores de periódicos impresos y similares;1902;Socorro mutuo;Madrid;MADRID;188.0;;;;188.0;;;;;
El Gluten vendedores repartidores etc de pan;1903;Socorro mutuo;Madrid;MADRID;74.0;;;;74.0;;;;;
Sociedad de Socorros mutuos de Operarios y Dependientes de D Pedro Durán;1904;Socorro mutuo;Madrid;MADRID;24.0;;;;24.0;;;;;
Nueva Sociedad de Socorros mutuos de Obreros de pan francés;1904;Socorro mutuo;Madrid;MADRID;490.0;;;;490.0;;;;;
Montepio de la Central de Camareros;1904;Socorro mutuo;Madrid;MADRID;140.0;;;;140.0;;;;;
Montepío general obrero de España;1904;Socorro mutuo;Madrid;MADRID;;;;;;;;;;
Agrupación Socialista Madrileña;1882;Politica de partido;Madrid;MADRID;690.0;;;;690.0;;;;;
Círculo Instructivo de Obreros republicanos del distrito de la Inclusa;1893;Politica de partido;Madrid;MADRID;377.0;;;;377.0;;;;;
Centro Instructivo de Obreros republicanos del distrito de la Latina;1903;Politica de partido;Madrid;MADRID;620.0;;4.0;1.0;625.0;;;;;
Centro Instructivo de Obreros republicanos del distrito de Cuatro Caminos;1903;Politica de partido;Madrid;MADRID;200.0;;;;200.0;;;;;
Centro Instructivo de Obreros republicanos del distrito de Buenavista;1904;Politica de partido;Madrid;MADRID;642.0;;;;642.0;;;;;
Juventud Socialista Madrileña;1904;Politica de partido;Madrid;MADRID;72.0;;;;72.0;;;;;
Centro Republicano de instrucción popular;1904;Politica de partido;Madrid;MADRID;223.0;;;;223.0;;;;;
Centro Instructivo del Obrero;1877;Instruccion;Madrid;MADRID;320.0;31.0;19.0;;370.0;;;;;
Sociedad Coral Eco de Madrid;1895;Coral;Madrid;MADRID;55.0;12.0;1.0;7.0;75.0;;;;;
Asociacion de Obreros de todos los oficios;1902;Mejorar las condiciones del trabajo;Alcala De Henares;MADRID;37.0;;;5.0;42.0;;;;;
Sociedad de Obreros Agricultores;1903;Mejorar las condiciones del trabajo;Alcala De Henares;MADRID;220.0;;;;220.0;;;;;
La Escuadra obreros carpinteros;1903;Mejorar las condiciones del trabajo;Alcala De Henares;MADRID;27.0;;;;27.0;;;;;
La Llana obreros albañiles;1903;Mejorar las condiciones del trabajo;Alcala De Henares;MADRID;132.0;;;;132.0;;;;;
Sociedad de Obreros constructores de calzado;1903;Mejorar las condiciones del trabajo;Alcala De Henares;MADRID;16.0;;;;16.0;;;;;
La Unión Obrera;1900;Socorro mutuo;Getafe;MADRID;262.0;;;1.0;263.0;;;;;
Centro Obrero;1903;Mejorar las condiciones del trabajo;Navalcarnero;MADRID;190.0;;;;190.0;;;;;
Sociedad de Sacadores de piedra y Carreteros;1904;Mejorar las condiciones del trabajo;Alpedrete;MADRID;125.0;;;;125.0;;;;;
Agrupación de Obreros;1903;Mejorar las condiciones del trabajo;Barjas;MADRID;132.0;;;;132.0;;;;;
Sociedad de Sacadores de piedra Y Carreteros;1898;Mejorar las condiciones del trabajo;Becerril;MADRID;100.0;;;;100.0;;;;;
Sociedad de Sacadores de piedra Y Carreteros;1904;Mejorar las condiciones del trabajo;Boalo;MADRID;47.0;;1.0;;48.0;;;;;
Sociedad de Obreros braceros;1904;Mejorar las condiciones del trabajo;Ciempozuelos;MADRID;104.0;;;;104.0;;;;;
Sociedad de Sacadores de piedra Y Carreteros;1904;Mejorar las condiciones del trabajo;Colladomediano;MADRID;101.0;;;;101.0;;;;;
El Bracero;1903;Mejorar las condiciones del trabajo;Colladovillalba;MADRID;64.0;;;;64.0;;;;;
Sociedad de Sacadores de piedra Y Carreteros;1904;Mejorar las condiciones del trabajo;Colladovillalba;MADRID;44.0;;;;44.0;;;;;
Centro Obrero Republicano;1904;Política de partido;Chamartin De La Rosa;MADRID;74.0;;1.0;;75.0;;;;;
Sociedad de Sacadores de piedra Y Carreteros;1904;Mejorar las condiciones del trabajo;Los Molinos;MADRID;22.0;;;;22.0;;;;;
La Fortuna obreros agricultores;1903;Mejorar las condiciones del trabajo;Mejorada Del Campo;MADRID;80.0;;;;80.0;;;;;
Círculo Obrero;1904;Mejorar las condiciones del trabajo;Mejorada Del Campo;MADRID;343.0;;;;343.0;;;;;
Sociedad de Sacadores de piedra Y Carreteros;1904;Mejorar las condiciones del trabajo;Moralzarxal;MADRID;80.0;;;;80.0;;;;;
Fraternidad Obrera;1891;Mejorar las condiciones del trabajo;Pinto;MADRID;167.0;;;;167.0;;;;;
La Voz;1900;Mejorar las condiciones del trabajo;Rascafria;MADRID;65.0;;;;65.0;;;;;
La Libertad;1903;Mejorar las condiciones del trabajo;Valdilecha;MADRID;42.0;;;;42.0;;;;;
La Honradez personal de los talleres generales del ferrocarril de M C P;1897;Cooperativa de consumo;Villaverde;MADRID;36.0;;2.0;;38.0;;;;;
Sociedad de Obreros del ramo de construccion;1900;Mejorar las condiciones del trabajo;Vallecas;MADRID;25.0;;;;25.0;;;;;
Union de Trabajadores;1903;Mejorar las condiciones del trabajo;Vicalvaro;MADRID;19.0;;;;19.0;;;;;
La Nocturna panaderos;1898;Mejorar las condiciones del trabajo;Oviedo;OVIEDO;25.0;;;;25.0;;;;;
La Emancipacion obreros en madera;1899;Mejorar las condiciones del trabajo;Oviedo;OVIEDO;409.0;;;;409.0;;;;;
La Reforma obreros en piedra;1899;Mejorar las condiciones del trabajo;Oviedo;OVIEDO;405.0;;;;405.0;;;;;
Asociación de Empleados de Industria y Comercio;1900;Mejorar las condiciones del trabajo;Oviedo;OVIEDO;95.0;;1.0;;96.0;;;;;
El Progreso obreros en hierro y demás metales;1900;Mejorar las condiciones del trabajo;Oviedo;OVIEDO;177.0;;;;177.0;;;;;
El Porvenir albañiles;1900;Mejorar las condiciones del trabajo;Idern;OVIEDO;400.0;;;;400.0;;;;;
El primero de Mayo pintores;1900;Mejorar las condiciones del trabajo;Idern;OVIEDO;30.0;;;;30.0;;;;;
El Bienestar sastres y sastras;1901;Mejorar las condiciones del trabajo;Idern;OVIEDO;30.0;;;;30.0;;;;;
La Perla;1904;Cooperativa de consumo;Idern;OVIEDO;10.0;;;;10.0;;;;;
San Mateo;1886;Socorro mutuo;Idern;OVIEDO;241.0;;2.0;6.0;249.0;;;;;
La Vanguardia canteros;1899;Mejorar las condiciones del trabajo;Avilés;OVIEDO;60.0;;;;60.0;;;;;
La Luz albañiles y pintores;1900;Mejorar las condiciones del trabajo;Avilés;OVIEDO;55.0;;;;55.0;;;;;
La unión es fuerza carpinteros;1900;Mejorar las condiciones del trabajo;Avilés;OVIEDO;142.0;;;;142.0;;;;;
La Firmeza obreros en hierro y demás metales;1900;Mejorar las condiciones del trabajo;Avilés;OVIEDO;24.0;;;;24.0;;;;;
La Legalización aserradores mecánicos;1901;Mejorar las condiciones del trabajo;Avilés;OVIEDO;20.0;;;;20.0;;;;;
Centro de Sociedades obreras;1900;Mejorar las condiciones del trabajo;Avilés;OVIEDO;102.0;;;;102.0;;;;;
