Sociedad de Obreros zapateros y similares;1904;Mejorar la condiciones de trabajo;Logroño;LOGROÑO;16.0;;;;16.0;;;;;
Caja de Auxilios del personal obrero de la Fábrica de Tabacos;1901;Socorro mutuo;Logroño;LOGROÑO;603.0;;;;603.0;;;;;
Círculo Católico de Obreros;1903;Acción católica;Calahorra;LOGROÑO;500.0;;100.0;25.0;625.0;;;;;
Unión Obrera;1904;Mejorar las condiciones elel trabajo;Calahorra;LOGROÑO;149.0;;;;149.0;;;;;
Sociedad Obrera Alpargatera;1902;Socorro mutuo;Cervera De Río Alhama;LOGROÑO;436.0;;12.0;9.0;457.0;;;;;
Asociación Obrera Agrícola;1904;Socorro mutuo;Cervera De Río Alhama;LOGROÑO;32.0;;;;32.0;;;;;
Unión Obrera Harense;1892;Socorro mutuo;Haro;LOGROÑO;286.0;1.0;3.0;15.0;305.0;;;;;
La Unión Artesana;1866;Recreativa;Haro;LOGROÑO;270.0;2.0;;;272.0;;;;;
Sociedad Obrera Agrícola;1903;Mejorar las condiciones del trabajo;Anguciana;LOGROÑO;60.0;;;;60.0;;;;;
Sociedad Obrera Agrícola;1902;Mejorar las condiciones del trabajo;Casaleria;LOGROÑO;90.0;;;;90.0;;;;;
Sociedael Benéfica entre trabajadores;0;Socorro mutuo;El Villar De Arnedo;LOGROÑO;55.0;;;9.0;64.0;;;;;
La Esperanza;1903;Socorro mutuo;Ezcaray;LOGROÑO;47.0;;;23.0;70.0;;;;;
Sociedad Obrera Agricola;1903;Mejorar la condiciones de trabajo;San Asensio;LOGROÑO;60.0;;;;60.0;;;;;
Sociedad Obrera Agrícola;1902;Mejorar la condiciones de trabajo;San Vicente De La Sonsierra;LOGROÑO;45.0;;;;45.0;;;;;
Sociedad Obrera Agrícola;1902;Mejorar la condiciones de trabajo;Zarraton;LOGROÑO;46.0;;;;46.0;;;;;
Sociedad de Oficiales Albaniles;1890;Mejorar las condiciones de trabajo;Lerida;LERIDA;140.0;;;;140.0;;;;;
Sociedad de Peones Albaniles;1900;Mejorar las condiciones de trabajo;Lerida;LERIDA;106.0;;;;106.0;;;;;
Sociedad de Obreros panaderos;1902;Mejorar las condiciones de trabajo;Lerida;LERIDA;42.0;;;;42.0;;;;;
Sociedad Encargados de Obra;1902;Mejorar las condiciones de trabajo;Lerida;LERIDA;16.0;;;;16.0;;;;;
Sociedad Obreros Ladrilleros;1902;Mejorar las condiciones de trabajo;Lerida;LERIDA;27.0;;;1.0;28.0;;;;;
La Union peluqueros barberos;1903;Mejorar las condiciones de trabajo;Lerida;LERIDA;30.0;;;;30.0;;;;;
Sociedad Oficiales zapateros;1903;Mejorar las condiciones de trabajo;Lerida;LERIDA;120.0;;;;120.0;;;;;
Sociedad de Camareros;1903;Mejorar las condiciones de trabajo;Lerida;LERIDA;56.0;;;;56.0;;;;;
Sociedad Constructores de Carros y Herreros;1904;Mejorar las condiciones de trabajo;Lerida;LERIDA;32.0;;;;32.0;;;;;
Federacion Provincial Obrera;1903;Mejorar las condiciones de trabajo;Lerida;LERIDA;250.0;;;;250.0;;;;;
Centro Obrero Republicano;1902;Politica de partido;Alguerri;LERIDA;;1.0;1.0;1.0;1465.0;;;;;
Sociedad Obrera Productiva y Auxiliar;1903;Mejorar las condiciones de trabajo;Alguaire;LERIDA;137.0;;;;137.0;;;;;
Sociedad de Albaniles y Picapedreros;0;Mejorar las condiciones de trabajo;Borjas;LERIDA;32.0;;;;32.0;;;;;
Sociedad Cooperativa benefica obrera Borjense;1898;Socorro mutuo;Borjas;LERIDA;202.0;;22.0;1.0;225.0;;;;;
Sociedad Agricola Obrera;1903;Mejorar las condiciones de trabajo;Os De Balaguer;LERIDA;80.0;;;;80.0;;;;;
Centro Republicano Obrero Instructivo;1903;Politica de partido;Tarrega;LERIDA;216.0;2.0;11.0;;229.0;;;;;
Centro Agricola Obrero;1903;Mejorar las condiciones de trabajo;Trago;LERIDA;27.0;;;;27.0;;;;;
Sociedad Obrera Progresista;1902;Mejorar las condiciones de trabajo;Trago(boix);LERIDA;21.0;;4.0;;25.0;;;;;
Sociedad Obrera Agricola de Socorros Mutuos;1904;Socorro mutuo;Valldert;LERIDA;26.0;;;;26.0;;;;;
La Armonia Verdunense;1896;Coral;Verdu;LERIDA;30.0;;;160.0;190.0;;;;;
Asociacion de Obreros del Arte de Imprimir y sus ramos afines;1899;Mejorar las condiciones del trabajo;Sevilla;SEVILLA;119.0;;;;119.0;;;;;
Asociación del Gremio de Carpinteros y sus ramos afines;1900;Mejorar las condiciones del trabajo;Sevilla;SEVILLA;500.0;;;;500.0;;;;;
Asociación de Obreros albañiles;1900;Mejorar las condiciones del trabajo;Sevilla;SEVILLA;1562.0;;;;1562.0;;;;;
Sociedad de Sombrererosplanchistas;1901;Mejorar las condiciones del trabajo;Sevilla;SEVILLA;150.0;;;;150.0;;;;;
La Igualdad obreros guanteros;1901;Mejorar las condiciones del trabajo;Sevilla;SEVILLA;15.0;;;;15.0;;;;;
Sociedad del Gremio de Hojalateros de envases;1901;Mejorar las condiciones del trabajo;Sevilla;SEVILLA;19.0;;;;19.0;;;;;
Asociación de Dependientes de Comercio;1902;Mejorar las condiciones del trabajo;Sevilla;SEVILLA;423.0;1.0;2.0;4.0;430.0;;;;;
Sociedad de Fundidores y similares;1903;Mejorar las condiciones del trabajo;Sevilla;SEVILLA;205.0;;;;205.0;;;;;
Los Hijos del Oficio obreros albañiles;1903;Mejorar las condiciones del trabajo;Sevilla;SEVILLA;422.0;;;;422.0;;;;;
El Faro obreros confiteros y pasteleros;1904;Mejorar las condiciones del trabajo;Sevilla;SEVILLA;100.0;;;;100.0;;;;;
Avante obreros marineros;1904;Mejorar las condiciones del trabajo;Sevilla;SEVILLA;216.0;;;;216.0;;;;;
Sociedad de Vendedores de periódicos;1904;Mejorar las condiciones del trabajo;Sevilla;SEVILLA;56.0;;;;56.0;;;;;
El Guadalquivir;1903;Cooperativa de consumo;Sevilla;SEVILLA;295.0;;2.0;2.0;299.0;;;;;
Los Menestrales;1846;Socorro mutuo;Sevilla;SEVILLA;200.0;;1.0;;201.0;;;;;
Sociedad de Socorros mutuos de Artesanos honrados;1854;Socorro mutuo;Sevilla;SEVILLA;160.0;;;;160.0;;;;;
Sociedad de Socorros mutuos de Cameros;1899;Socorro mutuo;Sevilla;SEVILLA;150.0;;;;150.0;;;;;
Protección Obrera;1899;Socorro mutuo;Sevilla;SEVILLA;100.0;;;;100.0;;;;;
La Agricultora;1900;Socorro mutuo;Sevilla;SEVILLA;150.0;;;;150.0;;;;;
Unión Obrera;1900;Socorro mutuo;Sevilla;SEVILLA;79.0;;;;79.0;;;;;
El Auxilio del Obrero;1901;Socorro mutuo;Sevilla;SEVILLA;51.0;;1.0;;52.0;;;;;
Caja de Auxiliares en beneficio del personal obrero de la Fabrica de Tabacos;1901;Socorro mutuo;Sevilla;SEVILLA;;;;;;;;;;
Union ArtisticoIndustrial;1904;Socorro mutuo;Sevilla;SEVILLA;64.0;;12.0;;76.0;;;;;
Primero de Mayo agrupacion socialista;1902;Politica de partido;Sevilla;SEVILLA;21.0;;;;21.0;;;;;
Centro Instructivo de Obreros Republicanos;1904;Politica de partido;Sevilla;SEVILLA;178.0;;1.0;;179.0;;;;;
Sociedad Gremial de Albañiles;1898;Mejorar las condiciones del trabajo;Carmona;SEVILLA;363.0;;1.0;;364.0;;;;;
Sociedad Gremial de Carpinteros;1898;Mejorar las condiciones del trabajo;Carmona;SEVILLA;90.0;;;;90.0;;;;;
La Union obrera de calzado y sus ramos afines;1902;Mejorar las condiciones del trabajo;Ecija;SEVILLA;103.0;;4.0;;107.0;;;;;
La Defensa de Gremio de Albaniles;1902;Mejorar las condiciones del trabajo;Ecija;SEVILLA;314.0;;;;314.0;;;;;
El Progreso obreros carpinteros;1903;Mejorar las condiciones del trabajo;Ecija;SEVILLA;40.0;;;;40.0;;;;;
Sociedad de Obreros encaladores;1903;Mejorar las condiciones del trabajo;Ecija;SEVILLA;11.0;;;;11.0;;;;;
La Protección obreros carpinteros;1902;Socorro mutuo;Ecija;SEVILLA;50.0;;;;50.0;;;;;
Circula Obrero Independiente;1903;Instrucción;Ecija;SEVILLA;300.0;;;70.0;370.0;;;;;
La Verdad obreros agricultores y similares;1902;Mejorar las condiciones del trabajo;Estepa;SEVILLA;32.0;;;;32.0;;;;;
Casino de Artesanos;1888;Instrucción y Recreo;Moron;SEVILLA;135.0;;;;135.0;;;;;
Centro Benefico Instructivo y Economico de Obreros;1903;Socorro mutuo;Alacalá De Guadaira;SEVILLA;143.0;;1.0;41.0;185.0;;;;;
Celeste Imperio;1903;Instrucción y Recreo;Alacalá De Guadaira;SEVILLA;150.0;;;;150.0;;;;;
Progreso y Fraternidad;1903;Mejorar las condiciones del trabajo;Badolatosa;SEVILLA;170.0;;2.0;;172.0;;;;;
La Libertad;1900;Mejorar las condiciones del trabajo;Brenes;SEVILLA;424.0;;;;424.0;;;;;
La Constancia;1903;Mejorar las condiciones del trabajo;Cantillana;SEVILLA;571.0;193.0;1.0;1.0;766.0;;;;;
Sociedad Obrera de Socorros Mutuos;1903;Socorro mutuo;Carrión De Los Céspedes;SEVILLA;38.0;;;;38.0;;;;;
El Coriano Trabajador;1903;Mejorar las condiciones del trabajo;Coria Del Rio;SEVILLA;463.0;;;;463.0;;;;;
La Alegria;1904;Cooperativa de consumo;El Castillo De Las Guardas (el Madroño);SEVILLA;41.0;;;;41.0;;;;;
Circulo Instructivo de Obreros agricultores;1903;Instrucción;El Coronil;SEVILLA;32.0;;;;32.0;;;;;
Unión Obrera;1904;Socorro mutuo;Espartinas;SEVILLA;70.0;;;;70.0;;;;;
Liga Obrera;1903;Mejorar las condiciones del trabajo;La Luisiana;SEVILLA;126.0;;1.0;;127.0;;;;;
Unión y Fraternidad obreros agricultores;1900;Mejorar las condiciones del trabajo;Las Cabezas De San Juan;SEVILLA;499.0;;1.0;;500.0;;;;;
Sociedad de Agricultores Artes y Oficios;1904;Mejorar las condiciones del trabajo;Palomares;SEVILLA;20.0;;;;20.0;;;;;
Circulo de Obreros Catolicos;0;Acción católica;Huesca;HUESCA;70.0;;;96.0;166.0;;;;;
Orfeón Oscense;1902;Coral;Huesca;HUESCA;50.0;;1.0;50.0;101.0;;;;;
La Protectora mutua;1897;Socorro mutuo;Boltaña;HUESCA;120.0;;6.0;;126.0;;;;;
Sociedad de Oficiales albañiles;1903;Mejorar las condiciones del trabajo;Fraga;HUESCA;20.0;;;;20.0;;;;;
Sociedad Obrera de Socorros Mutuos;1904;Socorro mutuo;Castillonroy;HUESCA;53.0;;;;53.0;;;;;
Sociedad de Obreros albañiles Jienenses;1900;Mejorar las condiciones del trabajo;Jaén;JAÉN;400.0;;;;400.0;;;;;
Sociedad de Canteros y Marmolistas;1900;Mejorar las condiciones del trabajo;Jaén;JAÉN;31.0;;4.0;;35.0;;;;;
Sociedad de Obreros panaderos Jienenses;1900;Mejorar las condiciones del trabajo;Jaén;JAÉN;70.0;;;;70.0;;;;;
Sociedad de Carpinteros y Ebanistas;1900;Mejorar las condiciones del trabajo;Jaén;JAÉN;100.0;;;;100.0;;;;;
Sociedad Obrera de Constructores de carruajes Herreros Carreteros y Cerrajeros;1901;Mejorar las condiciones del trabajo;Jaén;JAÉN;46.0;;5.0;;51.0;;;;;
La Necesaria obreros agricultores;1901;Mejorar las condiciones del trabajo;Jaén;JAÉN;356.0;;;;356.0;;;;;
Federación de Sociedades obreras;1901;Mejorar las condiciones del trabajo;Jaén;JAÉN;950.0;;;;950.0;;;;;
Sociedad de Obreros de las Riveras;1903;Socorro mutuo;Alcalá La Real;JAÉN;72.0;;;;72.0;;;;;
Sociedad de Obreros;1904;Mejorar las condiciones del trabajo;Alcalá La Real;JAÉN;140.0;;;;140.0;;;;;
Asociación general de Obreros;1902;Mejorar las condiciones del trabajo;Andújar;JAÉN;300.0;;;;300.0;;;;;
La Reformada;1891;Socorro mutuo;Andújar;JAÉN;68.0;;;;68.0;;;;;
Sociedad de Obreros panaderos;1904;Mejorar las condiciones del trabajo;La Carolina;JAÉN;23.0;;;;23.0;;;;;
El Freno maquinistas fogoneros y poceros;1890;Mejorar las condiciones del trabajo;Linares;JAÉN;95.0;;;;95.0;;;;;
Sociedad de Obreros panaderos;1894;Mejorar las condiciones del trabajo;Linares;JAÉN;50.0;;;;50.0;;;;;
El Porvenir fundidores y desplatadores de plomo;1900;Mejorar las condiciones del trabajo;Linares;JAÉN;200.0;;;;200.0;;;;;
La Reforma albañiles;1901;Mejorar las condiciones del trabajo;Linares;JAÉN;250.0;;;;250.0;;;;;
La Barrena mineros;1904;Mejorar las condiciones del trabajo;Linares;JAÉN;30.0;;;;30.0;;;;;
Federación de Sociedades obreras de resistencia;1900;Mejorar las condiciones del trabajo;Linares;JAÉN;;;;;;;;;;
El Fiscal;1904;Velar por el cumplimiento de la legislación protectora del trabajo;Linares;JAÉN;19.0;;;;19.0;;;;;
Círculo Socialista Obrero;1887;Política de partido;Linares;JAÉN;50.0;;;;50.0;;;;;
La Primitiva;1903;Mejorar las condiciones del trabajo;Mancha Real;JAÉN;300.0;;;;300.0;;;;;
El Triunfo;1903;Mejorar las condiciones del trabajo;Martos;JAÉN;;;;;;;;;;
El Progreso;1901;Mejorar las condiciones del trabajo;Arjona;JAÉN;130.0;;;;130.0;;;;;
La Unión Obrera;1902;Socorro mutuo;Banos De La Encina;JAÉN;215.0;;;;215.0;;;;;
La Esperanza;1903;Socorro mutuo;Beas De Segura;JAÉN;88.0;;;;88.0;;;;;
Centro Obrero;1904;Socorro mutuo;Chiclana;JAÉN;133.0;;1.0;18.0;152.0;;;;;
Sociedad de Obreros Agricolas;1903;Mejorar las condiciones del trabajo;Fuerte Del Rey;JAÉN;98.0;;;;98.0;;;;;
Centro de Trabajadores;1890;Mejorar las condiciones del trabajo;Guarromán;JAÉN;265.0;;;;265.0;;;;;
Círculo de Artesanos;1897;Instrucción;Ibros;JAÉN;73.0;;;;73.0;;;;;
La Popular;1904;Socorro mutuo;Javalquinto;JAÉN;70.0;;;;70.0;;;;;
Hijos del Trabajo;1904;Mejorar las condiciones del trabajl;La Guardia;JAÉN;100.0;;;;100.0;;;;;
Paz y Libertad agricultores;1903;Mejorar las condiciones del trabajl;Porcuna;JAÉN;220.0;;;;220.0;;;;;
Círculo de Artesanos;1904;Recreo;Santiago De Calatrava;JAÉN;100.0;;;;100.0;;;;;
Sociedad de;1903;Mejorar las condiciones del trabajo;Torre Del Campo;JAÉN;18.0;;;;18.0;;;;;
El Porvenir del;1904;Mejorar las condiciones del trabajo;Torredonjimeno;JAÉN;;;;;;;;;;
La Regeneración;1899;Cooperativa de consumo;Torredonjimeno;JAÉN;49.0;;;;49.0;;;;;
Sociedad Obrera del;1902;Mejorar las condiciones del trabajo;Valdepenas;JAÉN;19.0;;;;19.0;;;;;
Amigos de la Instrucción;1895;Instrucción;Valdepenas;JAÉN;127.0;;;;127.0;;;;;
Gremio de Carpinteros y Ebanistas;1900;Mejorar la condiciones de trabajo;Guadalajara;GUADALAJARA;37.0;;;;37.0;;;;;
Sociedad de Pastores de ganado lanar vacuno y similares;1902;Mejorar la condiciones de trabajo;Guadalajara;GUADALAJARA;14.0;;;;14.0;;;;;
La Invencible obreros panaderos;1902;Mejorar la condiciones de trabajo;Guadalajara;GUADALAJARA;48.0;;2.0;;50.0;;;;;
La Esperanza obreros del hierro;1902;Mejorar la condiciones de trabajo;Guadalajara;GUADALAJARA;26.0;;;;26.0;;;;;
La Aurora obreros agricultores;1903;Mejorar la condiciones de trabajo;Guadalajara;GUADALAJARA;160.0;;;;160.0;;;;;
Circulo Instructivo Obrero;1904;Instruccion;Cifuentes;GUADALAJARA;70.0;;;;70.0;;;;;
Circulo Obrero;1904;Instruccion;Sacedon;GUADALAJARA;41.0;;;;41.0;;;;;
La Buena Union;1896;Socorro mutuo;Hiendelaencina;GUADALAJARA;81.0;;;11.0;92.0;;;;;
Sociedad Obrera de Cerámica;1903;Mejorar las condiciones del trabajo;Segovia;SEGOVIA;83.0;;;;83.0;;;;;
Sociedad de Socorros mutuos;1903;Socorro mutuo;Nava De La Asunción;SEGOVIA;101.0;;1.0;;102.0;;;;;
El Pensamiento;1903;Mejorar las condiciones del trabajo;Villacastín;SEGOVIA;30.0;;;;30.0;;;;;
Sociedad de obreros marmolistas picapedreros;1882;Mejorar las condiciones del trabajo;Granada;GRANADA;94.0;;;;94.0;;;;;
La Fraternidad obreros sombrereros fulistas;1888;Mejorar las condiciones del trabajo;Granada;GRANADA;140.0;;;;140.0;;;;;
La Union;1900;Mejorar las condiciones del trabajo;Granada;GRANADA;25.0;;;;25.0;;;;;
La Obra;1900;Mejorar las condiciones del trabajo;Granada;GRANADA;390.0;;;60.0;450.0;;;;;
La Emancipacion obreros albaniles;1900;Mejorar las condiciones del trabajo;Granada;GRANADA;100.0;;;;100.0;;;;;
Gremio de Obreros panaderos;1902;Mejorar las condiciones del trabajo;Granada;GRANADA;150.0;;;;150.0;;;;;
La Igualdad;1903;Mejorar las condiciones del trabajo;Granada;GRANADA;60.0;;;;60.0;;;;;
Gremio de Sillerosguarnicioneros;1903;Mejorar las condiciones del trabajo;Granada;GRANADA;20.0;;;;20.0;;;;;
Sociedad de Socorros mutuos de vendedores de berzas y frutas;1890;Socorro mutuo;Granada;GRANADA;23.0;;1.0;;24.0;;;;;
Sociedad de Socorros mutuos de Empleados de tranvías;1904;Socorro mutuo;Granada;GRANADA;27.0;;3.0;;30.0;;;;;
La Paz;1903;Mejorar las condiciones del trabajo;Alhama;GRANADA;54.0;31.0;;3.0;88.0;;;;;
La Moralidad;1900;Cooperativa de producción y de crédito;Idem;GRANADA;15.0;12.0;1.0;1.0;29.0;;;;;
Los Obreros Bastetanos;1899;Mejorar las condiciones del trabajo;Baza;GRANADA;49.0;;;;49.0;;;;;
El Provenir obreros agricultores;1903;Mejorar las condiciones del trabajo;Baza;GRANADA;39.0;;;;39.0;;;;;
Sociedad Obrera Lojena;1901;Mejorar las condiciones del trabajo;Loja;GRANADA;203.0;;4.0;30.0;237.0;;;;;
La Obra;1902;Mejorar las condiciones del trabajo;Alfacar;GRANADA;119.0;;8.0;;127.0;;;;;
La Constancia;1900;Mejorar las condiciones del trabajo;Algarinejo;GRANADA;45.0;;;;45.0;;;;;
La Obra;1902;Mejorar las condiciones del trabajo;Atarfe;GRANADA;29.0;;;;29.0;;;;;
La Obra;1902;Mejorar las condiciones del trabajo;Campotéjar;GRANADA;60.0;;;;60.0;;;;;
La Obra;1903;Mejorar las condiciones del trabajo;Cúllar De Baza;GRANADA;28.0;;;;28.0;;;;;
La Obra;1902;Mejorar las condiciones del trabajo;Chimeneas;GRANADA;20.0;;9.0;;29.0;;;;;
La Hurnanitaria;1904;Socorro mutuo;Churriana;GRANADA;30.0;;;;30.0;;;;;
El Porvenir del Obrero;1903;Mejorar las condiciones del trabajo;Jun;GRANADA;14.0;;4.0;6.0;24.0;;;;;
Sociedad;1902;Mejorar las condiciones del trabajo;Pinospuente;GRANADA;27.0;16.0;4.0;;47.0;;;;;
La Constancia;1903;Mejorar las condiciones del trabajo;Pinospuente (asquerosa);GRANADA;25.0;;;1.0;26.0;;;;;
Redención;1904;Socorro mutuo;Puebla De Don Fadrique;GRANADA;435.0;;;10.0;445.0;;;;;
El Trabajo obreros albaniles;1900;Mejorar las condiciones del trabajo;Huelva;HUELVA;35.0;;;;35.0;;;;;
Gremio de Zapateros asociados;1900;Mejorar las condiciones del trabajo;Huelva;HUELVA;30.0;;;;30.0;;;;;
La Familiar cortadores de carne de vaca;1902;Mejorar las condiciones del trabajo;Huelva;HUELVA;14.0;;;;14.0;;;;;
Sociedad de Socorros Mutuos de Obreros del Rio Tinto;1877;Socorro mutuo;Huelva;HUELVA;53.0;;;1.0;54.0;;;;;
La Humanitaria;1899;Socorro mutuo;Huelva;HUELVA;41.0;;1.0;;42.0;;;;;
Sociedad de Socorros mutuos;1901;Socorro mutuo;Huelva;HUELVA;37.0;1.0;;;38.0;;;;;
La Favorita;1903;Socorro mutuo;Huelva;HUELVA;90.0;;;;90.0;;;;;
La Socorrida;1904;Socorro mutuo;Huelva;HUELVA;24.0;;1.0;;25.0;;;;;
Orfeón Onubense;1904;Coral;Huelva;HUELVA;35.0;;1.0;15.0;51.0;;;;;
Centro de Obreros;1894;Instrucción y recreo;Aracena;HUELVA;156.0;;;;156.0;;;;;
Unión de Trabajadores;1903;Instrucción y recreo;Alájar;HUELVA;30.0;;1.0;3.0;34.0;;;;;
El Siglo XX;1903;Socorro mutuo;Almonaster La Real;HUELVA;53.0;;;;53.0;;;;;
Sociedad de Socorros mutuos;1901;Socorro mutuo;Calañas;HUELVA;64.0;;;;64.0;;;;;
El Alba;1902;Socorro mutuo;Calañas;HUELVA;578.0;;;;578.0;;;;;
La Obrera;1904;Socorro mutuo;Calañas;HUELVA;63.0;;4.0;;67.0;;;;;
Centro de Unión Republicana;1904;Política de partido;Calañas;HUELVA;384.0;;1.0;;385.0;;;;;
La Buena Amistad;1904;Instrucción y recreo;Calañas;HUELVA;164.0;;5.0;;169.0;;;;;
Sociedad de Obreros;1903;Instrucción y recreo;Campofrío;HUELVA;49.0;;1.0;;50.0;;;;;
El Trabajo;1902;Mejorar las condiciones del trabajo;Cortegana;HUELVA;504.0;;;;504.0;;;;;
Sociedad Cooperativa;1901;Socorro mutuo;Chucena;HUELVA;163.0;;;;163.0;;;;;
Centro Obrero Republicano;1904;Política de partido;El Cerro;HUELVA;200.0;;;;200.0;;;;;
Sociedad de Instrucción obrera;1904;Instrucción;Galaroza;HUELVA;60.0;;;;60.0;;;;;
La Union Social;1903;Instrucción;Jabugo;HUELVA;130.0;;;;130.0;;;;;
Los Emancipados;1896;Cooperativa de consumo;Minas De Río Tinto;HUELVA;296.0;;;;296.0;;;;;
La Benéfica;1891;Socorro mutuo;Minas De Río Tinto;HUELVA;;;4.0;3.0;1084.0;;;;;
Unión de Dependientes de Comercio;1903;Mejorar las condiciones del trabajo;Nerva;HUELVA;20.0;;2.0;;22.0;;;;;
La Peña;1904;Cooporativa de consumo;Nerva;HUELVA;140.0;;;1.0;141.0;;;;;
Círculo de la Unión de Mineros;1900;Instrucción y recreo;Nerva;HUELVA;980.0;20.0;9.0;1.0;1010.0;;;;;
La Minera;1903;Socorro mutuo;Nerva;HUELVA;180.0;;1.0;9.0;190.0;;;;;
La Libertad;1904;Cooperativa de consumo;San Bartolomé De La Torre;HUELVA;105.0;;;;105.0;;;;;
La Fraternidad;1904;Cooperativa de consumo;San Bartolomé De La Torre;HUELVA;120.0;;;;120.0;;;;;
El Amparo;1897;Cooperativa de crédito;Villalba Del Alcor;HUELVA;28.0;;;;28.0;;;;;
Sociedad de Carpinteros y Ebanistas;1890;Mejorar las condiciones del trabajo;Pontevedra;PONTEVEDRA;200.0;;;;200.0;;;;;
Sociedad de Canteros;1895;Mejorar las condiciones del trabajo;Pontevedra;PONTEVEDRA;306.0;;;;306.0;;;;;
Sociedad de Obreros curtidores;1902;Mejorar las condiciones del trabajo;Pontevedra;PONTEVEDRA;32.0;;;;32.0;;;;;
Sociedad de Canteros;1904;Mejorar las condiciones del trabajo;Puente Caldelas;PONTEVEDRA;50.0;;;;50.0;;;;;
Sociedad de Obreros agrícolas;1903;Mejorar las condiciones del trabajo;Tuy (pazos De Reyes);PONTEVEDRA;70.0;;;;70.0;;;;;
Asociación de Obreros agrícolas;1903;Mejorar las condiciones del trabajo;Tuy (pazos De Reyes);PONTEVEDRA;150.0;;;;150.0;;;;;
Sociedad de Carpinteros;1902;Mejorar las condiciones del trabajo;Tuy;PONTEVEDRA;35.0;;;;35.0;;;;;
Sociedad de Obreros agrícolas;1904;Mejorar las condiciones del trabajo;Tuy;PONTEVEDRA;70.0;;;;70.0;;;;;
Unión general Agrícola;1902;Mejorar las condiciones del trabajo;Tuy;PONTEVEDRA;100.0;;;;100.0;;;;;
Círculo Católico de Obreros;1904;Acción católica;Vigo;PONTEVEDRA;536.0;;2.0;26.0;564.0;;;;;
Sociedad de Canteros;1894;Mejorar las condiciones del trabajo;Vigo;PONTEVEDRA;310.0;;;;310.0;;;;;
Sociedad de Pintores y Albañiles;1894;Mejorar las condiciones del trabajo;Vigo;PONTEVEDRA;230.0;;;;230.0;;;;;
Sociedad de Hojalateros soldadores;1897;Mejorar las condiciones del trabajo;Vigo;PONTEVEDRA;148.0;;;;148.0;;;;;
Sociedad de Obreros panaderos;1899;Mejorar las condiciones del trabajo;Vigo;PONTEVEDRA;98.0;;;;98.0;;;;;
Sociedad de obreros peones;1900;Mejorar las condiciones del trabajo;Vigo;PONTEVEDRA;150.0;;;;150.0;;;;;
Asociación general de Dependientes delComercio I;1900;Mejorar las condiciones del trabajo;Vigo;PONTEVEDRA;150.0;1.0;;25.0;176.0;;;;;
Asociación Tipográfica y Artes similares;1900;Mejorar las condiciones del trabajo;Vigo;PONTEVEDRA;73.0;;;;73.0;;;;;
Sociedad de Obreros zapateros;1901;Mejorar las condiciones del trabajo;Vigo;PONTEVEDRA;60.0;;;;60.0;;;;;
Federación de Trabajadores;1895;Mejorar las condiciones del trabajo;Vigo;PONTEVEDRA;1108.0;;;;1108.0;;;;;
Agrupación Socialista;1900;Política de partido;Vigo;PONTEVEDRA;74.0;;;;74.0;;;;;
Sociedad de Canteros;1900;Mejorar las condiciones del trabajo;Bayona;PONTEVEDRA;36.0;;;;36.0;;;;;
Federación de Trabajadores;1901;Mejorar las condiciones del trabajo;Bayona;PONTEVEDRA;90.0;;;;90.0;;;;;
Trabajo;1900;Mejorar las condiciones del trabajo;Bouzas;PONTEVEDRA;74.0;;;;74.0;;;;;
Sociedad de Soldadores de conservas;1901;Mejorar las condiciones del trabajo;Bouzas;PONTEVEDRA;120.0;;;;120.0;;;;;
Sociedad de Canteros;1896;Mejorar las condiciones del trabajo;Bueu;PONTEVEDRA;20.0;;;;20.0;;;;;
Sociedad de Canteros;1902;Mejorar las condiciones del trabajo;Gangas;PONTEVEDRA;55.0;;;;55.0;;;;;
Unión Carrileña;1903;Mejorar las condiciones del trabajo;Carril;PONTEVEDRA;676.0;;4.0;;680.0;;;;;
Sociedad de Oficios y Profesiones varias;1902;Mejorar las condiciones del trabajo;Gondomar;PONTEVEDRA;80.0;;;;80.0;;;;;
La Nueva Idea;1904;Mejorar las condiciones del trabajo;Lalin;PONTEVEDRA;30.0;;;;30.0;;;;;
Agrupación Socialista;1904;Política de partido;Lavadores;PONTEVEDRA;23.0;;;;23.0;;;;;
Sociedad de Canteros;0;Mejorar las condiciones del trabajo;Marín;PONTEVEDRA;148.0;;;;148.0;;;;;
No más deberes sin derechos no más derechos sin deberes obreros carpinteros;1897;Mejorar las condiciones del trabajo;Marín;PONTEVEDRA;40.0;;;;40.0;;;;;
El Porvenir de la Mujer;1900;Mejorar las condiciones del trabajo;Marín;PONTEVEDRA;100.0;;;;100.0;;;;;
Asociación de Marineros pescadores pulperos;1902;Mejorar las condiciones del trabajo;Marín;PONTEVEDRA;20.0;;;;20.0;;;;;
Asociación de Marineros pescadores;1903;Mejorar las condiciones del trabajo;Marín;PONTEVEDRA;18.0;;;;18.0;;;;;
Federación Obrera;1901;Mejorar las condiciones del trabajo;Marín;PONTEVEDRA;;;;;;;;;;
Sociedad de Canteros;1899;Mejorar las condiciones del trabajo;Porrino;PONTEVEDRA;43.0;;;;43.0;;;;;
Sociedad de Constructores de calzado;1903;Mejorar las condiciones del trabajo;Porrino;PONTEVEDRA;20.0;;;;20.0;;;;;
Federación local de Trabajadores;1900;Mejorar las condiciones del trabajo;Porrino;PONTEVEDRA;134.0;;;;134.0;;;;;
Sociedad de Obreros agrícolas;1904;Mejorar las condiciones del trabajo;Salceda;PONTEVEDRA;67.0;;3.0;;70.0;;;;;
Sociedad de Oficios varios;1903;Mejorar las condiciones del trabajo;Sangenjo;PONTEVEDRA;109.0;;;;109.0;;;;;
Sociedad de Canteros;1903;Mejorar las condiciones del trabajo;Vilaboa;PONTEVEDRA;106.0;;;;106.0;;;;;
Asociación de Marineros;1900;Mejorar las condiciones del trabajo;Villajuán;PONTEVEDRA;238.0;;;;238.0;;;;;
Centro de Instrucción Democrático;1903;Instrucción;Teruel;TERUEL;535.0;;4.0;;539.0;;;;;
Sociedad obrera;1903;Mejorar las condiciones de trabajo;Hijar;TERUEL;145.0;;;;145.0;;;;;
La Luz del Porvenir;1904;Socorro mutuo;Manzanera;TERUEL;31.0;;;;31.0;;;;;
La Amistad oficiales toneleros;1899;Mejorar las condiciones del trabajo;Cordova;CÓRDOVA;30.0;;;;30.0;;;;;
Asociacion de Carpinteros;1900;Mejorar las condiciones del trabajo;Cordova;CÓRDOVA;125.0;;;;125.0;;;;;
Gremio de Pintores y Decoradores;1900;Mejorar las condiciones del trabajo;Cordova;CÓRDOVA;43.0;;;;43.0;;;;;
Sociedad de Albañiles;1900;Mejorar las condiciones del trabajo;Cordova;CÓRDOVA;520.0;;;;520.0;;;;;
Sociedad de Conductores de carruajes;1901;Mejorar las condiciones del trabajo;Cordova;CÓRDOVA;48.0;;;;48.0;;;;;
La Cordobesa oficiales barberos;1902;Mejorar las condiciones del trabajo;Cordova;CÓRDOVA;55.0;;;;55.0;;;;;
Sociedad de Peones albañiles;1904;Mejorar las condiciones del trabajo;Cordova;CÓRDOVA;201.0;;;;201.0;;;;;
Sociedad de Socorros mutuos de Orífices y Plateros;1868;Socorro mutuo;Cordova;CÓRDOVA;147.0;;;;147.0;;;;;
Amigos del Trabajo;1901;Cooperativa de producción agrícola;Cabra;CÓRDOVA;168.0;;;;168.0;;;;;
Círculo Católico de Obreros;1877;Acción católica;Lucena;CÓRDOVA;425.0;;4.0;26.0;455.0;;;;;
Liga Obrera;1904;Mejorar las condiciones del trabajo;Lucena;CÓRDOVA;420.0;;;;420.0;;;;;
Sociedad de Obreros curtidores;1900;Mejorar las condiciones del trabajo;Montilla;CÓRDOVA;18.0;;;;18.0;;;;;
Sociedad colectiva de Socorro mutuo;1894;Cooperativa de crédito;Montilla;CÓRDOVA;244.0;;;;244.0;;;;;
Asociación de Dependientes de Comercio;1904;Mejorar las condiciones del trabajo;Pozoblanco;CÓRDOVA;3.0;9.0;4.0;;16.0;;;;;
Cooperativa de Obreros;1900;Cooperativa de producción agricola;La Rambla;CÓRDOVA;78.0;;;;78.0;Cultivo de la vid.;;;;
Círculo Obrero de Instrucción;1903;Instrucción;Belalcazar;CÓRDOVA;1002.0;;;;1002.0;Tiene organizada una escuela para adultos;;;;
Sociedad de Obreros agricultores;1901;Mejorar las condiciones del trabajo;Espejo;CÓRDOVA;42.0;;;;42.0;;;;;
Centro Obrero de Artesanos;1903;Mejorar las condiciones del trabajo;Espejo;CÓRDOVA;85.0;;;;85.0;;;;;
Sociedad de Agricultores Artes y Oficios;1902;Mejorar las condiciones del trabajo;Iznajar;CÓRDOVA;80.0;;;;80.0;;;;;
Centro de Obreros;1903;Mejorar las condiciones del trabajo;La Victoria;CÓRDOVA;105.0;;10.0;;115.0;;;;;
La Ilustración Obrera;1903;Mejorar las condiciones del trabajo;Montemayor;CÓRDOVA;82.0;;;;82.0;;;;;
